{
  "$schema": "https://json-schema.org/draft/2020-12/schema",
  "$id": "https://raw.githubusercontent.com/phynics/OmenArchive/refs/heads/main/schemas/mechanics-module.schema.json",
  "title": "Mechanics Module Descriptor",
  "description": "Deterministic archive contract exported by an executable mechanics module.",
  "type": "object",
  "properties": {
    "moduleID": {
      "type": "string",
      "pattern": "^[a-z0-9.-]+$"
    },
    "revision": {
      "type": "integer",
      "minimum": 1
    },
    "dependencies": {
      "type": "array",
      "items": {
        "$ref": "#/$defs/dependency"
      }
    },
    "valueTypes": {
      "type": "array",
      "items": {
        "$ref": "#/$defs/valueType"
      }
    },
    "effects": {
      "type": "array",
      "items": {
        "$ref": "#/$defs/effect"
      }
    },
    "stateKeys": {
      "type": "array",
      "items": {
        "$ref": "#/$defs/stateKey"
      }
    }
  },
  "required": [
    "moduleID",
    "revision",
    "dependencies",
    "valueTypes",
    "effects",
    "stateKeys"
  ],
  "additionalProperties": false,
  "$defs": {
    "dependency": {
      "type": "object",
      "properties": {
        "moduleID": {
          "type": "string",
          "pattern": "^[a-z0-9.-]+$"
        },
        "revision": {
          "type": "integer",
          "minimum": 1
        }
      },
      "required": [
        "moduleID",
        "revision"
      ],
      "additionalProperties": false
    },
    "valueType": {
      "type": "object",
      "properties": {
        "typeID": {
          "type": "string",
          "pattern": "^[a-z0-9.-]+/value/[a-z0-9-]+$"
        },
        "revision": {
          "type": "integer",
          "minimum": 1
        },
        "schema": {
          "type": "object"
        },
        "listElementTypeID": {
          "type": "string",
          "pattern": "^[a-z0-9.-]+/value/[a-z0-9-]+$",
          "description": "The registered element type of a homogeneous array value."
        }
      },
      "required": [
        "typeID",
        "revision",
        "schema"
      ],
      "additionalProperties": false
    },
    "effect": {
      "type": "object",
      "properties": {
        "reference": {
          "$ref": "#/$defs/effectReference"
        },
        "inputDescriptors": {
          "type": "array",
          "items": {
            "$ref": "#/$defs/inputDescriptor"
          }
        },
        "inputRecipes": {
          "type": "array"
        },
        "writes": {
          "type": "array",
          "items": {
            "$ref": "#/$defs/write"
          },
          "description": "The character state the effect writes, in terms of its inputs."
        }
      },
      "required": [
        "reference",
        "inputDescriptors",
        "inputRecipes"
      ],
      "additionalProperties": false
    },
    "write": {
      "type": "object",
      "properties": {
        "domain": {
          "enum": [
            "path",
            "sense",
            "skill",
            "saving-throw",
            "feature",
            "feat",
            "trait",
            "signature-spell",
            "innate-tradition"
          ]
        },
        "nameInput": {
          "type": "string",
          "description": "The input whose literal value names the state."
        },
        "nameMember": {
          "type": "string",
          "description": "For an object-valued input, the member holding the name."
        },
        "namePrefix": {
          "type": "string"
        },
        "fixedName": {
          "type": "string",
          "description": "A name that doesn't depend on an input."
        },
        "rankInput": {
          "type": "string",
          "description": "The input whose literal value is the proficiency rank written."
        },
        "modification": {
          "type": "boolean",
          "description": "The effect changes this state on records other rules made, so a rule prerequisite can't read it."
        }
      },
      "required": [
        "domain"
      ],
      "additionalProperties": false
    },
    "effectReference": {
      "type": "object",
      "properties": {
        "kindID": {
          "type": "string",
          "pattern": "^[a-z0-9.-]+/effect/[a-z0-9-]+$"
        },
        "revision": {
          "type": "integer",
          "minimum": 1
        }
      },
      "required": [
        "kindID",
        "revision"
      ],
      "additionalProperties": false
    },
    "inputDescriptor": {
      "type": "object",
      "properties": {
        "name": {
          "type": "string",
          "minLength": 1
        },
        "valueTypeID": {
          "type": "string",
          "pattern": "^[a-z0-9.-]+/value/[a-z0-9-]+$"
        },
        "optional": {
          "type": "boolean",
          "description": "The input may be left out of a rule. Optional inputs come after the required ones."
        }
      },
      "required": [
        "name",
        "valueTypeID"
      ],
      "additionalProperties": false
    },
    "stateKey": {
      "type": "object",
      "properties": {
        "keyID": {
          "type": "string",
          "pattern": "^[a-z0-9.-]+/state/[a-z0-9-]+$"
        },
        "revision": {
          "type": "integer",
          "minimum": 1
        },
        "valueTypeID": {
          "type": "string",
          "pattern": "^[a-z0-9.-]+/value/[a-z0-9-]+$"
        }
      },
      "required": [
        "keyID",
        "revision",
        "valueTypeID"
      ],
      "additionalProperties": false
    }
  }
}
