{"dependencies":[{"moduleID":"org.openomen.pf2e.core","revision":1}],"effects":[{"inputDescriptors":[{"name":"sourceId","valueTypeID":"org.openomen.pf2e.core/value/uuid"},{"name":"sourceName","valueTypeID":"org.openomen.pf2e.core/value/string"},{"name":"castingKind","valueTypeID":"org.openomen.pf2e.spellcasting/value/casting-kind"},{"name":"tradition","valueTypeID":"org.openomen.pf2e.spellcasting/value/tradition"},{"name":"attribute","valueTypeID":"org.openomen.pf2e.core/value/attribute"}],"inputRecipes":[],"reference":{"kindID":"org.openomen.pf2e.spellcasting/effect/configure-source","revision":1}},{"inputDescriptors":[{"name":"tradition","valueTypeID":"org.openomen.pf2e.spellcasting/value/tradition"},{"name":"proficiency","valueTypeID":"org.openomen.pf2e.core/value/proficiency-rank"}],"inputRecipes":[],"reference":{"kindID":"org.openomen.pf2e.spellcasting/effect/increase-proficiency","revision":1}},{"inputDescriptors":[{"name":"sourceId","valueTypeID":"org.openomen.pf2e.core/value/uuid"},{"name":"proficiency","valueTypeID":"org.openomen.pf2e.core/value/proficiency-rank"}],"inputRecipes":[],"reference":{"kindID":"org.openomen.pf2e.spellcasting/effect/increase-source-proficiency","revision":1}},{"inputDescriptors":[{"name":"sourceId","valueTypeID":"org.openomen.pf2e.core/value/uuid"},{"name":"spellRank","valueTypeID":"org.openomen.pf2e.core/value/int"},{"name":"count","valueTypeID":"org.openomen.pf2e.core/value/int"}],"inputRecipes":[],"reference":{"kindID":"org.openomen.pf2e.spellcasting/effect/grant-slot","revision":1}},{"inputDescriptors":[{"name":"sourceId","valueTypeID":"org.openomen.pf2e.core/value/uuid"},{"name":"grantId","valueTypeID":"org.openomen.pf2e.core/value/uuid"},{"name":"spellId","valueTypeID":"org.openomen.pf2e.spellcasting/value/spell-id"},{"name":"rankPolicy","valueTypeID":"org.openomen.pf2e.spellcasting/value/rank-policy"},{"name":"castFrequency","valueTypeID":"org.openomen.pf2e.spellcasting/value/cast-frequency"}],"inputRecipes":[],"reference":{"kindID":"org.openomen.pf2e.spellcasting/effect/grant-spell","revision":1}},{"inputDescriptors":[{"name":"sourceId","valueTypeID":"org.openomen.pf2e.core/value/uuid"},{"name":"sourceName","valueTypeID":"org.openomen.pf2e.core/value/string"},{"name":"grantId","valueTypeID":"org.openomen.pf2e.core/value/uuid"},{"name":"spellId","valueTypeID":"org.openomen.pf2e.spellcasting/value/spell-id"},{"name":"tradition","valueTypeID":"org.openomen.pf2e.spellcasting/value/tradition"},{"name":"attribute","valueTypeID":"org.openomen.pf2e.core/value/attribute"},{"name":"rankPolicy","valueTypeID":"org.openomen.pf2e.spellcasting/value/rank-policy"},{"name":"castFrequency","valueTypeID":"org.openomen.pf2e.spellcasting/value/cast-frequency"}],"inputRecipes":[],"reference":{"kindID":"org.openomen.pf2e.spellcasting/effect/grant-innate-spell","revision":1}},{"inputDescriptors":[{"name":"sourceId","valueTypeID":"org.openomen.pf2e.core/value/uuid"},{"name":"entryId","valueTypeID":"org.openomen.pf2e.core/value/uuid"},{"name":"spellId","valueTypeID":"org.openomen.pf2e.spellcasting/value/spell-id"}],"inputRecipes":[],"reference":{"kindID":"org.openomen.pf2e.spellcasting/effect/add-known-spell","revision":1}},{"inputDescriptors":[],"inputRecipes":[],"reference":{"kindID":"org.openomen.pf2e.spellcasting/effect/add-focus-point","revision":1}}],"moduleID":"org.openomen.pf2e.spellcasting","revision":1,"stateKeys":[],"valueTypes":[{"revision":1,"schema":{"kind":"enum","values":["prepared","spontaneous","innate","focus"]},"typeID":"org.openomen.pf2e.spellcasting/value/casting-kind"},{"revision":1,"schema":{"kind":"enum","values":["arcane","divine","occult","primal"]},"typeID":"org.openomen.pf2e.spellcasting/value/tradition"},{"revision":1,"schema":{"kind":"string"},"typeID":"org.openomen.pf2e.spellcasting/value/spell-id"},{"revision":1,"schema":{"additionalProperties":false,"kind":"object","properties":{"kind":{"kind":"enum","values":["fixed","cantrip"]},"rank":{"kind":"integer"}},"required":["kind"]},"typeID":"org.openomen.pf2e.spellcasting/value/rank-policy"},{"revision":1,"schema":{"additionalProperties":false,"kind":"object","properties":{"kind":{"kind":"enum","values":["atWill","perDay","focus"]},"uses":{"kind":"integer"}},"required":["kind"]},"typeID":"org.openomen.pf2e.spellcasting/value/cast-frequency"}]}
